term,definition,Disease,Symptom_1,Symptom_2,Symptom_3,Symptom_4,Symptom_5,Symptom_6,Symptom_7,Symptom_8,Symptom_9,Symptom_10,Symptom_11,Symptom_12,Symptom_13,Symptom_14,Symptom_15,Symptom_16,Symptom_17
Basal Body Temperature,"Basal body temperature is your temperature at rest when you wake up in the morning. This temperature rises slightly around the time of ovulation. Keeping track of this temperature and other changes such as cervical mucus may help you figure out when you are ovulating. Take your temperature before you get out of bed every morning. Since the change during ovulation is only about 1/2 degree F (1/3 degree C), you should use a sensitive thermometer such as a basal body thermometer.",Fungal infection,itching, skin_rash, nodal_skin_eruptions, dischromic _patches,,,,,,,,,,,,,
Blood Alcohol Content,"Blood alcohol content, or blood alcohol concentration (BAC), is the amount of alcohol in a given volume of blood.  For medical and legal purposes, BAC is expressed as grams of alcohol in a 100 milliliter sample of blood.",Fungal infection, skin_rash, nodal_skin_eruptions, dischromic _patches,,,,,,,,,,,,,,
Blood  Pressure,"Blood pressure is the force of blood pushing against the walls of the arteries as your heart pumps blood.  It includes two measurements. ""Systolic"" is your blood pressure when your heart beats while pumping blood. ""Diastolic"" is your blood pressure when the heart is at rest between beats. You usually see blood pressure numbers written with the systolic number above or before the diastolic number. For example, you might see 120/80.",Fungal infection,itching, nodal_skin_eruptions, dischromic _patches,,,,,,,,,,,,,,
Blood Type,"There are four major blood types: A, B, O, and AB. The types are based on substances on the surface of the blood cells.  Besides blood types, there is the Rh factor.  It is a protein on red blood cells. Most people are Rh-positive; they have Rh factor. Rh-negative people don't have it.  Rh factor is inherited though genes.",Fungal infection,itching, skin_rash, dischromic _patches,,,,,,,,,,,,,,
Body Mass Index,"Body Mass Index (BMI) is an estimate of your body fat.  It is calculated from your height and weight.  It can tell you whether you are underweight, normal, overweight, or obese. It can help you gauge your risk for diseases that can occur with more body fat. ",Fungal infection,itching, skin_rash, nodal_skin_eruptions,,,,,,,,,,,,,,
Body Temperature,Body temperature is a measure of your body’s level of heat. ,Fungal infection, skin_rash, nodal_skin_eruptions, dischromic _patches,,,,,,,,,,,,,,
Cervical Mucus,"Cervical mucus comes from the cervix. It collects in the vagina. Tracking the changes in your mucus during your cycle, along with changes in your basal body temperature, may help you figure out when you are ovulating.",Fungal infection,itching, nodal_skin_eruptions, dischromic _patches,,,,,,,,,,,,,,
Galvanic Skin  Response,Galvanic skin response is a change in electrical resistance of the skin.  It can occur in response to emotional arousal or other conditions.,Fungal infection,itching, skin_rash, dischromic _patches,,,,,,,,,,,,,,
Heart Rate,"Heart rate, or pulse, is how many times your heart beats in a period of time — usually a minute. The usual pulse for an adult is 60 to 100 beats per minute after resting for at least 10 minutes.",Fungal infection,itching, skin_rash, nodal_skin_eruptions,,,,,,,,,,,,,,
Height,Your height is the distance from the bottom of your feet to the top of your head when you are standing up straight.,Fungal infection,itching, skin_rash, nodal_skin_eruptions, dischromic _patches,,,,,,,,,,,,,
Inhaler Usage,An inhaler is a device that sprays medicine through your mouth to your lungs.,Allergy, continuous_sneezing, shivering, chills, watering_from_eyes,,,,,,,,,,,,,
Menstruation,"Menstruation, or period, is normal vaginal bleeding that happens as part of a woman's monthly cycle. Keeping track of your cycles helps you figure out when the next one will come, whether you missed one, and if there is a problem with your cycles.",Allergy, shivering, chills, watering_from_eyes,,,,,,,,,,,,,,
Ovulation Test,"Ovulation is the release of an egg from a woman's ovary. Ovulation tests detect a rise in a hormone level that happens just before ovulation. This can help you figure out when you will ovulate, and when you are most likely to get pregnant.",Allergy, continuous_sneezing, chills, watering_from_eyes,,,,,,,,,,,,,,
Respiratory Rate,Respiratory rate is your rate of breathing (inhalation and exhalation) within a certain time. It is usually stated as breaths per minute.,Allergy, continuous_sneezing, shivering, watering_from_eyes,,,,,,,,,,,,,,
Sexual Activity,Sexuality is part of being human and plays a role in healthy relationships. Keeping track of your sexual activity can help you watch for sexual problems and fertility problems. It can also help you learn about your risk for sexually transmitted diseases.,Allergy, continuous_sneezing, shivering, chills,,,,,,,,,,,,,,
Spotting,"Spotting is light vaginal bleeding that is not your period. It could be between periods, after menopause, or during pregnancy. There can be many different causes; some are serious and some are not. Contact your health care provider if you have spotting; call right away if you are pregnant.",Allergy, shivering, chills, watering_from_eyes,,,,,,,,,,,,,,
UV Exposure,"Ultraviolet (UV) rays are an invisible form of radiation from sunlight. They can help your body form vitamin D naturally. But they can pass through your skin and damage your skin cells, causing sunburn. UV rays can also cause eye problems, wrinkles, skin spots, and skin cancer.",Allergy, continuous_sneezing, chills, watering_from_eyes,,,,,,,,,,,,,,
Weight (Body Mass),Your weight is the mass or quantity of your heaviness.  It is expressed by units of pounds or kilograms.,Allergy, continuous_sneezing, shivering, watering_from_eyes,,,,,,,,,,,,,,
Activity Count,"Physical activity is any body movement that works your muscles and requires more energy than resting. Walking, running, dancing, swimming, yoga, and gardening are a few examples of physical activity.",Allergy, continuous_sneezing, shivering, chills,,,,,,,,,,,,,,
Aerobic Exercise,"Aerobic exercise is activity that moves your large muscles, such as those in your arms and legs.  It makes you breathe harder and your heart beat faster.  Examples include running, swimming, walking, and biking.  Over time, regular aerobic activity makes your heart and lungs stronger and able to work better.",Allergy, continuous_sneezing, shivering, chills, watering_from_eyes,,,,,,,,,,,,,
Basal Metabolic Rate,"Basal metabolic rate is the measure of the energy necessary for maintaining basic functions, such as breathing, heart rate, and digestion.",GERD, stomach_pain, acidity, ulcers_on_tongue, vomiting, cough, chest_pain,,,,,,,,,,,
Cool Down,"Your physical activity session should end by gradually slowing down. You can also cool down by changing to a less vigorous activity, such as moving from jogging to walking. This process allows your body to relax gradually.  A cool down can last 5 minutes or more.",GERD, stomach_pain, acidity, vomiting, cough, chest_pain,,,,,,,,,,,,
Energy Balance,"The balance between calories you get from eating and drinking and those you use up through physical activity and body processes like breathing, digesting food, and, in children, growing.",GERD, stomach_pain, acidity, ulcers_on_tongue, cough, chest_pain,,,,,,,,,,,,
Energy Consumed,"Energy is another word for calories. What you eat and drink is ""energy in."" What you burn through physical activity is ""energy out.""",GERD, stomach_pain, acidity, ulcers_on_tongue, vomiting, chest_pain,,,,,,,,,,,,
Flexibility  (Training),"Flexibility training is exercise that stretches and lengthens your muscles. It can help improve your joint flexibility and keep your muscles limber.  This can help prevent injuries. Some examples are yoga, tai chi, and pilates.",GERD, stomach_pain, acidity, ulcers_on_tongue, vomiting, cough,,,,,,,,,,,,
Maximum Heart Rate,The maximum heart rate is the fastest your heart can beat.,GERD, stomach_pain, ulcers_on_tongue, vomiting, cough, chest_pain,,,,,,,,,,,,
Perspiration,"Perspiration, or sweat, is a clear, salty liquid produced by glands in your skin.   It is how your body cools itself.  Sweating a lot is normal when it is hot or when you exercise, feel anxious, or have a fever. It can also happen during menopause.",GERD, stomach_pain, acidity, vomiting, cough, chest_pain,,,,,,,,,,,,
Strength Training,"Strength training, or resistance training, is exercise that works your muscles by making you push or pull against something. It strengthens your muscles and can improve your bone strength and balance. Some examples are lifting weights, working with resistance bands, and doing push-ups and pull-ups.",GERD, stomach_pain, acidity, ulcers_on_tongue, cough, chest_pain,,,,,,,,,,,,
Target Heart Rate,"Your target heart rate is a percentage of your maximum heart rate, which is the fastest your heart can beat.  It is based on your age.  The activity level that is best for your health uses 50–75 percent of your maximum heart rate. This range is your target heart rate zone.",Chronic cholestasis,itching, vomiting, yellowish_skin, nausea, loss_of_appetite, abdominal_pain, yellowing_of_eyes,,,,,,,,,,
Warm Up ,Your physical activity session should start at a slow-to-medium pace to give your body a chance to get ready for more vigorous movement. A warm up should last about 5 to 10 minutes.,Chronic cholestasis, vomiting, yellowish_skin, nausea, loss_of_appetite, abdominal_pain, yellowing_of_eyes,,,,,,,,,,,
Water Intake,"We all need to drink water. How much you need depends on your size, activity level, and the weather where you live. Keeping track of your water intake helps make sure that you get enough. Your intake includes fluids that you drink, and fluids you get from food.",Chronic cholestasis,itching, yellowish_skin, nausea, loss_of_appetite, abdominal_pain, yellowing_of_eyes,,,,,,,,,,,
Weight (Body Mass) ,Your weight is the mass or quantity of your heaviness.  It is expressed by units of pounds or kilograms.,Chronic cholestasis,itching, vomiting, nausea, loss_of_appetite, abdominal_pain, yellowing_of_eyes,,,,,,,,,,,
Antioxidants,"Antioxidants are substances that may prevent or delay some types of cell damage. Examples include beta-carotene, lutein, lycopene, selenium, and vitamins C and E. They are found in many foods, including fruits and vegetables.  They are also available as dietary supplements.  Most research has not shown antioxidant supplements to be helpful in preventing diseases.",Chronic cholestasis,itching, vomiting, yellowish_skin, loss_of_appetite, abdominal_pain, yellowing_of_eyes,,,,,,,,,,,
Calcium,"Calcium is a mineral found in many foods. Almost all calcium is stored in bones and teeth to help make and keep them strong.  Your body needs calcium to help muscles and blood vessels contract and expand, and to send messages through the nervous system.  Calcium is also used to help release hormones and enzymes that affect almost every function in the human body.",Chronic cholestasis,itching, vomiting, yellowish_skin, nausea, abdominal_pain, yellowing_of_eyes,,,,,,,,,,,
Daily Value (DV),The Daily Value (DV) tells you what percentage of a nutrient one serving of that food or supplement provides compared to the recommended amount.,Chronic cholestasis,itching, vomiting, yellowish_skin, nausea, loss_of_appetite, yellowing_of_eyes,,,,,,,,,,,
Dietary Supplements,A dietary supplement is a product you take to supplement your diet.  It contains one or more dietary ingredients (including vitamins; minerals; herbs or other botanicals; amino acids; and other substances).  Supplements do not have to go through the testing that drugs do for effectiveness and safety.,Chronic cholestasis,itching, vomiting, yellowish_skin, nausea, loss_of_appetite, abdominal_pain,,,,,,,,,,,
Electrolytes,"Electrolytes are minerals in body fluids.  They include sodium, potassium, magnesium, and chloride. When you are dehydrated, your body does not have enough fluid and electrolytes.",Chronic cholestasis,itching, vomiting, yellowish_skin, nausea, loss_of_appetite, abdominal_pain, yellowing_of_eyes,,,,,,,,,,
Iodine,Iodine is a mineral found in some foods. Your body needs iodine to make thyroid hormones. These hormones control your body’s metabolism and other functions. They are also important for bone and brain development during pregnancy and infancy.,Chronic cholestasis,itching, vomiting, yellowish_skin, nausea, loss_of_appetite, abdominal_pain, yellowing_of_eyes,,,,,,,,,,
Iron,"Iron is a mineral. It is also added to some food products and is available as a dietary supplement. Iron is a part of hemoglobin, a protein that transports oxygen from the lungs to the tissues. It helps provide oxygen to muscles. Iron is important for cell growth, development, and normal body functions.  Iron also helps the body make some hormones and connective tissue.",Drug Reaction,itching, skin_rash, stomach_pain, burning_micturition, spotting_ urination,,,,,,,,,,,,
Magnesium,"Magnesium is a mineral naturally present in many foods, and is added to other food products.  It is also available as a dietary supplement and present in some medicines.  It helps your body regulate muscle and nerve function, blood sugar levels, and blood pressure. It also helps your body make protein, bone, and DNA.",Drug Reaction,itching, stomach_pain, burning_micturition, spotting_ urination,,,,,,,,,,,,,
Minerals,"Minerals are those elements on the earth and in foods that our bodies need to develop and function normally.  Those essential for health include calcium, phosphorus, potassium, sodium, chloride, magnesium, iron, zinc, iodine, chromium, copper, fluoride, molybdenum, manganese, and selenium.",Drug Reaction,itching, skin_rash, burning_micturition, spotting_ urination,,,,,,,,,,,,,
Multivitamin/Mineral  Supplements,"Multivitamin/mineral supplements contain a combination of vitamins and minerals. They sometimes have other ingredients, such as herbs. They are also called multis, multiples, or simply vitamins. Multis help people get the recommended amounts of vitamins and minerals when they cannot or do not get enough of these nutrients from food.",Drug Reaction,itching, skin_rash, stomach_pain, spotting_ urination,,,,,,,,,,,,,
Phosphorus,"Phosphorus is a mineral that helps keep your bones healthy. It also helps keep blood vessels and muscles working. Phosphorus is found naturally in foods rich in protein, such as meat, poultry, fish, nuts, beans, and dairy products. Phosphorus is also added to many processed foods.",Drug Reaction,itching, skin_rash, stomach_pain, burning_micturition,,,,,,,,,,,,,
Potassium,"Potassium is a mineral that your cells, nerves, and muscles need to function properly. It helps your body regulate your blood pressure, heart rhythm and the water content in cells.  It also helps with digestion. Most people get all the potassium they need from what they eat and drink. It is also available as a dietary supplement.",Drug Reaction, skin_rash, stomach_pain, burning_micturition, spotting_ urination,,,,,,,,,,,,,
Recommended Dietary  Allowance (RDA),"Recommended Dietary Allowance (RDA) is the amount of a nutrient you should get each day.  There are different RDAs based on age, gender, and whether a woman is pregnant or breastfeeding.",Drug Reaction,itching, stomach_pain, burning_micturition, spotting_ urination,,,,,,,,,,,,,
Selenium,"Selenium is a mineral that the body needs to stay healthy. It is important for reproduction, thyroid function, and DNA production. It also helps protect the body from damage caused by free radicals (unstable atoms or molecules that can damage cells) and infections.  Selenium is present in many foods, and is sometimes added to other foods. It is also available as a dietary supplement.",Drug Reaction,itching, skin_rash, burning_micturition, spotting_ urination,,,,,,,,,,,,,
Sodium,Table salt is made up of the elements sodium and chlorine - the technical name for salt is sodium chloride. Your body needs some sodium to work properly. It helps with the function of nerves and muscles. It also helps to keep the right balance of fluids in your body.,Drug Reaction,itching, skin_rash, stomach_pain, spotting_ urination,,,,,,,,,,,,,
Zinc,"Zinc, a mineral that people need to stay healthy, is found in cells throughout the body. It helps the immune system fight off invading bacteria and viruses. The body also needs zinc to make proteins and DNA, the genetic material in all cells. During pregnancy, infancy, and childhood, the body needs zinc to grow and develop properly. Zinc also helps wounds heal and is important for our ability to taste and smell. Zinc is found in a wide variety of foods, and is found in most multivitamin/mineral supplements.",Drug Reaction,itching, skin_rash, stomach_pain, burning_micturition,,,,,,,,,,,,,
Fat-Soluble Vitamins,"Fat-soluble vitamins include vitamins A, D, E, and K. The body stores fat-soluble vitamins in the liver and fatty tissues.",Peptic ulcer diseae, vomiting, loss_of_appetite, abdominal_pain, passage_of_gases, internal_itching,,,,,,,,,,,,
Folate,Folate is a B-vitamin that is naturally present in many foods. A form of folate called folic acid is used in dietary supplements and fortified foods. Our bodies need folate to make DNA and other genetic material. Folate is also needed for the body’s cells to divide. It is important for women to get enough folic acid before and during pregnancy.  It can prevent major birth defects of the baby's brain or spine.,Peptic ulcer diseae, vomiting, indigestion, abdominal_pain, passage_of_gases, internal_itching,,,,,,,,,,,,
Niacin,"Niacin is a nutrient in the vitamin B complex. The body needs it in small amounts to function and stay healthy. Niacin helps some enzymes work properly and helps the skin, nerves, and digestive tract stay healthy.",Peptic ulcer diseae, vomiting, indigestion, loss_of_appetite, abdominal_pain, internal_itching,,,,,,,,,,,,
Vitamin A,"Vitamin A plays a role in your vision, bone growth, reproduction, cell functions, and immune system. Vitamin A is an antioxidant. It can come from plant or animal sources. Plant sources include colorful fruits and vegetables. Animal sources include liver and whole milk. Vitamin A is also added to foods like cereals.",Peptic ulcer diseae, vomiting, indigestion, loss_of_appetite, abdominal_pain, passage_of_gases, internal_itching,,,,,,,,,,,
Vitamin B6,Vitamin B6 is present in many foods and is added to other foods. The body needs vitamin B6 for many chemical reactions involved in metabolism. Vitamin B6 is involved in brain development during pregnancy and infancy. It also is involved in immune function.,Peptic ulcer diseae, vomiting, indigestion, loss_of_appetite, abdominal_pain, passage_of_gases, internal_itching,,,,,,,,,,,
Vitamin B12,"Vitamin B12 helps keep the body’s nerve and blood cells healthy.  It helps make DNA, the genetic material in all cells. Vitamin B12 also helps prevent a type of anemia that makes people tired and weak. Vitamin B12 is found naturally in a wide variety of animal foods.  It is also added to some fortified foods and is  found in most multivitamin supplements.",AIDS, muscle_wasting, patches_in_throat, high_fever, extra_marital_contacts,,,,,,,,,,,,,
Vitamin C,"Vitamin C is an antioxidant. It is important for your skin, bones, and connective tissue. It promotes healing and helps the body absorb iron. Vitamin C comes from fruits and vegetables. Good sources include citrus, red and green peppers, tomatoes, broccoli, and greens. Some juices and cereals have added vitamin C.",AIDS, patches_in_throat, high_fever, extra_marital_contacts,,,,,,,,,,,,,,
Vitamin D,"Vitamin D helps your body absorb calcium. Calcium is one of the main building blocks of bone. A lack of vitamin D can lead to bone diseases such as osteoporosis or rickets. Vitamin D also has a role in your nerve, muscle, and immune systems. You can get vitamin D in three ways: through your skin (from sunlight), from your diet, and from supplements. Your body forms vitamin D naturally after exposure to sunlight. However, too much sun exposure can lead to skin aging and skin cancer, so many people try to get their vitamin D from other sources. Vitamin D-rich foods include egg yolks, saltwater fish, and liver. Some other foods, like milk and cereal, often have added vitamin D. You can also take vitamin D supplements. Check with your health care provider to see how much you should take.",AIDS, muscle_wasting, high_fever, extra_marital_contacts,,,,,,,,,,,,,,
Vitamin E,"Vitamin E is an antioxidant. It plays a role in your immune system and metabolic processes. Most people get enough vitamin E from the foods they eat. Good sources of vitamin E include vegetable oils, margarine, nuts and seeds, and leafy greens. Vitamin E is added to foods like cereals. It is also available as a supplement.",AIDS, muscle_wasting, patches_in_throat, extra_marital_contacts,,,,,,,,,,,,,,
Vitamin K,Vitamin K helps your body by making proteins for healthy bones and tissues. It also makes proteins for blood clotting. There are different types of vitamin K. Most people get vitamin K from plants such as green vegetables and dark berries. Bacteria in your intestines also produce small amounts of another type of vitamin K.,AIDS, muscle_wasting, patches_in_throat, high_fever,,,,,,,,,,,,,,
Vitamins,"Vitamins are substances that our bodies need to develop and function normally. They include vitamins A, C, D, E, and K, choline, and the B vitamins (thiamin, riboflavin, niacin, pantothenic acid, biotin, vitamin B6, vitamin B12, and folate/folic acid).",AIDS, muscle_wasting, patches_in_throat, high_fever, extra_marital_contacts,,,,,,,,,,,,,
Water-Soluble  Vitamins,Water-soluble vitamins include all the B vitamins and vitamin C.  The body does not easily store water-soluble vitamins and flushes out the extra in the urine.,AIDS, muscle_wasting, patches_in_throat, high_fever, extra_marital_contacts,,,,,,,,,,,,,
Amino Acids,Amino acids are the building blocks of proteins. The body produces many amino acids and others come from food. The body absorbs amino acids through the small intestine into the blood.  Then the blood carries them throughout the body.,AIDS, patches_in_throat, high_fever, extra_marital_contacts,,,,,,,,,,,,,,
Blood Glucose,Glucose — also called blood sugar — is the main sugar found in the blood and the main source of energy for your body.,AIDS, muscle_wasting, high_fever, extra_marital_contacts,,,,,,,,,,,,,,
Calories,"A unit of energy in food. Carbohydrates, fats, protein, and alcohol in the foods and drinks we eat provide food energy or ""calories."" ",AIDS, muscle_wasting, patches_in_throat, high_fever,,,,,,,,,,,,,,
Carbohydrates,"Carbohydrates are one of the main types of nutrients. Your digestive system changes carbohydrates into glucose (blood sugar). Your body uses this sugar for energy for your cells, tissues and organs. It stores any extra sugar in your liver and muscles for when it is needed. There are two types of carbohydrates: simple and complex. Simple carbohydrates include natural and added sugars.  Complex carbohydrates include whole grain breads and cereals, starchy vegetables and legumes.",Diabetes , fatigue, weight_loss, restlessness, lethargy, irregular_sugar_level, blurred_and_distorted_vision, obesity, excessive_hunger, increased_appetite, polyuria,,,,,,,
Cholesterol,"Cholesterol is a waxy, fat-like substance that’s found in all cells of the body. Your body needs some cholesterol to make hormones, vitamin D, and substances that help you digest foods. Your body makes all the cholesterol it needs. However, cholesterol also is found in some of the foods you eat. High levels of cholesterol in the blood can increase your risk of heart disease.",Diabetes , fatigue, weight_loss, restlessness, lethargy, irregular_sugar_level, blurred_and_distorted_vision, obesity, excessive_hunger, increased_appetite, polyuria,,,,,,,
Dehydration,"Dehydration is a condition that happens when you do not take in enough liquids to replace those that you lose.  You can lose liquids through frequent urinating, sweating, diarrhea, or vomiting. When you are dehydrated, your body does not have enough fluid and electrolytes to work properly.",Diabetes , weight_loss, restlessness, lethargy, irregular_sugar_level, blurred_and_distorted_vision, obesity, excessive_hunger, increased_appetite, polyuria,,,,,,,,
Diet,"Your diet is made up of what you eat and drink.  There are many different types of diets, such as vegetarian diets, weight loss diets, and diets for people with certain health problems.",Diabetes , fatigue, restlessness, lethargy, irregular_sugar_level, blurred_and_distorted_vision, obesity, excessive_hunger, increased_appetite, polyuria,,,,,,,,
Digestion,"Digestion is the process the body uses to break down food into nutrients.  The body uses the nutrients for energy, growth, and cell repair.",Diabetes , fatigue, weight_loss, restlessness, irregular_sugar_level, blurred_and_distorted_vision, obesity, excessive_hunger, increased_appetite, polyuria,,,,,,,,
Enzymes,Enzymes are substances that speed up chemical reactions in the body.,Diabetes , fatigue, weight_loss, restlessness, lethargy, irregular_sugar_level, obesity, excessive_hunger, increased_appetite, polyuria,,,,,,,,
Fatty Acid,Fatty acid is a major component of fats that is used by the body for energy and tissue development.,Diabetes , fatigue, weight_loss, restlessness, lethargy, irregular_sugar_level, blurred_and_distorted_vision, excessive_hunger, increased_appetite, polyuria,,,,,,,,
